{
  "$schema": "../schema/evaluation-report.schema.json",
  "schema_version": "0.2.0",
  "report_id": "REPORT-ADOS-GLOSSARY-EVOLUTION-EXAMPLE",
  "generated_at_utc": "2026-06-19T00:00:00Z",
  "project": {
    "project_id": "ados-glossary",
    "name": "ADOS Glossary",
    "description": "Example multi-version evaluation showing stronger semantic baseline, later structural growth, false-PASS risk, and fixture overgeneralization."
  },
  "versions": [
    {
      "version_id": "VER-V1.3",
      "label": "1.3",
      "role": "baseline_candidate"
    },
    {
      "version_id": "VER-V1.4",
      "label": "1.4",
      "role": "historical"
    },
    {
      "version_id": "VER-V1.5",
      "label": "1.5",
      "role": "target"
    }
  ],
  "inputs": [
    {
      "source_id": "SRC-V13-RESULT",
      "version_id": "VER-V1.3",
      "input_type": "build_result",
      "name": "ados-glossary-v1.3.zip",
      "availability": "available",
      "notes": "Evaluated as baseline candidate."
    },
    {
      "source_id": "SRC-V14-RESULT",
      "version_id": "VER-V1.4",
      "input_type": "build_result",
      "name": "ados-glossary-v1.4.zip",
      "availability": "available",
      "notes": "Structurally expanded result."
    },
    {
      "source_id": "SRC-V15-BUILD",
      "version_id": "VER-V1.5",
      "input_type": "build_package",
      "name": "v1.5 control pack",
      "availability": "available",
      "notes": "Strong control design."
    },
    {
      "source_id": "SRC-V15-AGENT",
      "version_id": "VER-V1.5",
      "input_type": "agent_work",
      "name": "v1.5 agent response and activity evidence",
      "availability": "partial",
      "notes": "Available response, build summary, and activity log."
    },
    {
      "source_id": "SRC-V15-RESULT",
      "version_id": "VER-V1.5",
      "input_type": "build_result",
      "name": "ados-glossary-v1.5.zip",
      "availability": "available",
      "notes": "Delivered package."
    }
  ],
  "semantic_frame": {
    "user_request": {
      "summary": "Improve ADOS Glossary quality across versions while preserving the concept model and strengthening package/profile behavior.",
      "evidence_status": "partial",
      "confidence": "medium",
      "support_refs": [
        "prior build prompts and supplied evaluation context"
      ]
    },
    "intent": {
      "summary": "Produce a stronger schema-governed ADOS Profile and runtime-capable glossary package.",
      "evidence_status": "confirmed",
      "confidence": "high",
      "support_refs": [
        "v1.4 and v1.5 build-control documents"
      ]
    },
    "goal": {
      "summary": "Maintain a trustworthy ADOS glossary/profile whose semantics, machine contracts, evidence, and downstream claims remain aligned.",
      "evidence_status": "confirmed",
      "confidence": "high",
      "support_refs": [
        "v1.3 package authority",
        "v1.5 PDD Goal"
      ]
    },
    "objectives": [
      {
        "summary": "Preserve and synchronize glossary and machine semantic surfaces.",
        "evidence_status": "confirmed",
        "confidence": "high",
        "support_refs": [
          "glossary/profile objectives"
        ]
      },
      {
        "summary": "Strengthen schemas and validation without weakening contract meaning.",
        "evidence_status": "confirmed",
        "confidence": "high",
        "support_refs": [
          "v1.5 schema objectives"
        ]
      },
      {
        "summary": "Demonstrate downstream behavior through bounded proof artifacts.",
        "evidence_status": "confirmed",
        "confidence": "high",
        "support_refs": [
          "calculator and broader proof obligations"
        ]
      }
    ],
    "ados_profile_expectations": [
      {
        "summary": "Profile Archetype with Governance and Software-Engineering Domain concerns.",
        "evidence_status": "confirmed",
        "confidence": "high",
        "support_refs": [
          "package purpose and artifact form"
        ]
      },
      {
        "summary": "Applicable Pillars include Goal formation, traceability, schema-backed data, semantic reflection, document governance, and ADOS compliance verification.",
        "evidence_status": "partial",
        "confidence": "medium",
        "support_refs": [
          "ADOS concept model"
        ]
      }
    ],
    "glossary_terms_used": [
      {
        "term_id": "TERM-PROFILE-ARCHETYPE",
        "evaluation_purpose": "Classify the primary Delivery."
      },
      {
        "term_id": "TERM-GOVERNANCE-DOMAIN",
        "evaluation_purpose": "Interpret authority and compliance concerns."
      },
      {
        "term_id": "TERM-GOAL",
        "evaluation_purpose": "Establish the desired end state."
      },
      {
        "term_id": "TERM-QUALITY-DRIFT",
        "evaluation_purpose": "Classify cross-version degradation."
      },
      {
        "term_id": "TERM-BASELINE-VERSION",
        "evaluation_purpose": "Select the strongest next baseline."
      },
      {
        "term_id": "TERM-QA-EVIDENCE",
        "evaluation_purpose": "Interpret validation and calculator proof claims."
      }
    ]
  },
  "selected_archetype": {
    "id": "ARCH-PROFILE",
    "confidence": "high",
    "rationale": "The primary Delivery defines glossary, schema, terminology, governance, and profile meaning for downstream Projects.",
    "alternatives": [
      {
        "id": "ARCH-RUNTIME",
        "reason_not_selected": "Runtime proof is secondary to the profile/glossary Delivery."
      },
      {
        "id": "ARCH-PROMPT",
        "reason_not_selected": "Prompts control builds but are not the primary Delivery."
      }
    ]
  },
  "selected_domain": {
    "id": "DOMAIN-GOVERNANCE",
    "confidence": "high",
    "rationale": "The Project primarily governs terminology, package meaning, authority, compliance, and quality interpretation.",
    "alternatives": [
      {
        "id": "DOMAIN-SOFTWARE-ENGINEERING",
        "reason_not_selected": "Software engineering is important but secondary to the governance/profile purpose."
      }
    ]
  },
  "stage_evaluations": [
    {
      "stage_evaluation_id": "STAGE-V13-RESULT",
      "version_id": "VER-V1.3",
      "input_type": "build_result",
      "source_ids": [
        "SRC-V13-RESULT"
      ],
      "coordinates": [
        {
          "coordinate_id": "COORD-GOAL-ALIGNMENT",
          "metric_id": "MET-GOAL-ALIGNMENT",
          "score": 8.0,
          "confidence": "high",
          "evidence_status": "confirmed",
          "rationale": "v1.3 remains closely aligned with the glossary/profile Goal.",
          "support_refs": [
            "v1.3 package evaluation"
          ]
        },
        {
          "coordinate_id": "COORD-SEMANTIC-INTEGRITY",
          "metric_id": "MET-SEMANTIC-INTEGRITY",
          "score": 9.0,
          "confidence": "high",
          "evidence_status": "confirmed",
          "rationale": "Glossary, registry, concept matrix, and SKOS were materially synchronized.",
          "support_refs": [
            "v1.3 semantic comparison"
          ]
        },
        {
          "coordinate_id": "COORD-BUILD-RESULT-QUALITY",
          "metric_id": "MET-BUILD-RESULT-QUALITY",
          "score": 7.5,
          "confidence": "high",
          "evidence_status": "confirmed",
          "rationale": "Strong contracts with bounded packaging and reference defects.",
          "support_refs": [
            "v1.3 package evaluation"
          ]
        }
      ],
      "total_score": 81.7,
      "total_score_method": "Illustrative average of the three reported coordinates scaled to 100.",
      "strengths": [
        "Strong semantic synchronization.",
        "Strict machine contracts relative to later versions."
      ],
      "limitations": [
        "Some stale hashes and references.",
        "No strong package-local validation runtime."
      ],
      "uncertainties": []
    },
    {
      "stage_evaluation_id": "STAGE-V14-RESULT",
      "version_id": "VER-V1.4",
      "input_type": "build_result",
      "source_ids": [
        "SRC-V14-RESULT"
      ],
      "coordinates": [
        {
          "coordinate_id": "COORD-GOAL-ALIGNMENT",
          "metric_id": "MET-GOAL-ALIGNMENT",
          "score": 6.0,
          "confidence": "high",
          "evidence_status": "partial",
          "rationale": "The package expanded the profile/runtime idea but drifted from semantic reliability.",
          "support_refs": [
            "v1.4 comparison"
          ]
        },
        {
          "coordinate_id": "COORD-SEMANTIC-INTEGRITY",
          "metric_id": "MET-SEMANTIC-INTEGRITY",
          "score": 4.0,
          "confidence": "high",
          "evidence_status": "contradicted",
          "rationale": "New terms and exports were not fully synchronized.",
          "support_refs": [
            "v1.4 semantic comparison"
          ]
        },
        {
          "coordinate_id": "COORD-BUILD-RESULT-QUALITY",
          "metric_id": "MET-BUILD-RESULT-QUALITY",
          "score": 5.5,
          "confidence": "high",
          "evidence_status": "partial",
          "rationale": "Structure improved, but work grounding, evidence, and validator sensitivity were weak.",
          "support_refs": [
            "v1.4 package evaluation"
          ]
        }
      ],
      "total_score": 51.7,
      "total_score_method": "Illustrative average of the three reported coordinates scaled to 100.",
      "strengths": [
        "Cleaner folder model.",
        "JSON-only ADR direction.",
        "Functional calculator fixture."
      ],
      "limitations": [
        "Semantic desynchronization.",
        "Weak validator sensitivity.",
        "Ungrounded work records."
      ],
      "uncertainties": []
    },
    {
      "stage_evaluation_id": "STAGE-V15-BUILD",
      "version_id": "VER-V1.5",
      "input_type": "build_package",
      "source_ids": [
        "SRC-V15-BUILD"
      ],